id,url,date,content,replyCount,retweetCount,likeCount,quoteCount
1487604798190936065,https://twitter.com/ColumbiaBugle/status/1487604798190936065,2022-01-30 01:53:16+00:00,"President Trump Calling Out Biden &amp; Washington For Focusing On Ukraine's Border Instead Of America's Border

""It's always America Last.""

""Before Joe Biden sends any troops to defend a border in Eastern Europe he should be sending troops to defend our border right here in Texas."" https://t.co/sqUeQo09fI",552,3727,13322,291
1499829665447436296,https://twitter.com/GeorgePapa19/status/1499829665447436296,2022-03-04 19:30:32+00:00,"Breaking: After Kamala Harris failed to secure the southern border, and then Ukraine’s, she has now been ordered to the Polish border.

What’s the worst that could happen?",548,1053,5581,80
1493282583068696579,https://twitter.com/georgegalloway/status/1493282583068696579,2022-02-14 17:54:46+00:00,Y’all said #Russia was about to invade #Ukraine. I told you it wasn’t. You were wrong. I was right. Again. Show some bloody humility. Especially if they’re not even paying you to act like an idiot.,547,329,1704,366
1498391843637456896,https://twitter.com/PaulMcCartney/status/1498391843637456896,2022-02-28 20:17:08+00:00,Remembering playing for our friends in Ukraine in Independence Square in 2008 and thinking of them in these difficult times. We send our love and support. 🇺🇦 #StandWithUkraine 1/2 https://t.co/aGTQ3xW9KX,545,6993,46307,363
1497276667991138311,https://twitter.com/disclosetv/status/1497276667991138311,2022-02-25 18:25:50+00:00,JUST IN - Large convoy of lethal NATO supplies crossed the border into Ukraine. Poland's Minister of Defence Mariusz Błaszczak shared this picture. https://t.co/4BQI6bituH,545,3096,10969,604
1499874917055090692,https://twitter.com/lesiavasylenko/status/1499874917055090692,2022-03-04 22:30:21+00:00,I really do want to stay positive. So to end the Twitter feed for tonight: 390 babies were born in #Ukraine during these 9 days of war: 199 boys and 191 girls. #StandWithUkraine for our future https://t.co/gSWyZpzwhA,543,6416,33317,389
1489962611173212171,https://twitter.com/AP/status/1489962611173212171,2022-02-05 14:02:23+00:00,"When the Biden administration was asked for evidence to back up national security claims, it simply demurred: You’ll have to trust us. They would not reveal how they knew that Russia was plotting a false flag operation as a pretext to invade Ukraine. https://t.co/1ycjx4C4ap",542,306,1080,208
1498443642389909504,https://twitter.com/AndrzejDuda/status/1498443642389909504,2022-02-28 23:42:58+00:00,"I’ve just talked with President @ZelenskyyUa about the war in Ukraine. Russian rockets and missiles, including the internationally banned cluster bombs, are dropping on residential quarters of Kiev, Kharkiv and other cities. The situation is difficult but Ukraine is brave! 🇵🇱🤝🇺🇦",539,728,4976,38
1499170489972969476,https://twitter.com/RhonddaBryant/status/1499170489972969476,2022-03-02 23:51:12+00:00,"The only statement I want to hear from Roman Abramovich is ‘this invasion is illegal, Vladimir Putin send the Russian troops home immediately’.",538,2816,18517,188
1498380255152726023,https://twitter.com/nypost/status/1498380255152726023,2022-02-28 19:31:06+00:00,Billionaire investor Bill Ackman says US troops must defend Ukraine from Russia https://t.co/VmsRTlnq86 https://t.co/OpPpINEpuq,536,79,424,110
1497340335508316169,https://twitter.com/DineshDSouza/status/1497340335508316169,2022-02-25 22:38:49+00:00,"The Left is beating the jingoistic drums on #Ukraine because they know they have a blithering idiot in the Oval Office who barely knows what’s going on around him, let alone on the Russian border. Sorry guys but he’s YOUR moron—not ours.",535,1270,5973,49
1496979753127055361,https://twitter.com/antonioguterres/status/1496979753127055361,2022-02-24 22:46:00+00:00,"The use of force by one country against another is wrong, against the @UN Charter, and unacceptable.

But it is not irreversible.
  
I repeat my appeal to President Putin:

Stop the military operation in Ukraine.

Bring the troops back to Russia. https://t.co/gIxI8ffIYJ",532,1385,3941,153
1492218267099975684,https://twitter.com/amanpour/status/1492218267099975684,2022-02-11 19:25:33+00:00,Official from a NATO ally tells me Pres Biden told them today the US does believe Vladimir Putin has decided to attack Ukraine. Next week.,530,1982,4439,653
1497708467997585412,https://twitter.com/newtgingrich/status/1497708467997585412,2022-02-26 23:01:39+00:00,"President Zelensky is a profile in courage while President Biden is a profile in timidity, confusion and irresponsibility. As an American it is embarrassing to have such an unnecessary failure. Ukraine can defeat Putin with our help but no American troops.",526,769,4654,80
1497353497402314755,https://twitter.com/VictorianCHO/status/1497353497402314755,2022-02-25 23:31:07+00:00,"Having seen the horrific health consequences of war in Afghanistan, I am appalled at the unfolding situation in #Ukraine today. There is no moral defence for such tragedy.",524,585,6630,47
1495102667257004033,https://twitter.com/NotHoodlum/status/1495102667257004033,2022-02-19 18:27:08+00:00,Scary Palin: “I can see the war in Ukraine from my house.” https://t.co/NE0oNQV84o,522,234,2343,47
1498705685885894669,https://twitter.com/KyivIndependent/status/1498705685885894669,2022-03-01 17:04:14+00:00,"⚡️BREAKING: European Parliament recommends giving Ukraine EU candidate status.

The decision follows President Zelensky’s speech, where he called on the EU to “prove” that the union is with Ukraine. The resolution also demands that Russia withdraws all its troops from Ukraine.",518,10347,58442,568
1495141743498436609,https://twitter.com/McFaul/status/1495141743498436609,2022-02-19 21:02:24+00:00,"During his 2 decades in power, Putin has gone to war many times: Chechnya 1999, Georgia 2008, Syria 2015, Ukraine 2014. In Putin's view, he won every time. Given this perceived track record, he believes he can win again now.",515,2324,8009,130
1489361682581315590,https://twitter.com/michaeljknowles/status/1489361682581315590,2022-02-03 22:14:30+00:00,"State Dept.: Russia is going to launch a false flag attack as a pretext to invade Ukraine.

Reporter: What's your evidence?

State Dept.: I just gave it to you.

Reporter: No, you made an allegation.

State Dept.: Yes, that's the evidence.

Reporter: 😐

https://t.co/lC1pRxNiso",508,1304,5410,294
1498042517555712002,https://twitter.com/doctor_oxford/status/1498042517555712002,2022-02-27 21:09:03+00:00,"This is @BorisJohnson attending mass at a Ukrainian church in London this evening.

To date there is *still* no simple sanctuary route to the UK for Ukrainian refugees fleeing war.

#StandWithUkraine 🇺🇦🌻 https://t.co/cMOy6Y9ahj",506,1006,4286,200
1495112202596065286,https://twitter.com/kirstiealley/status/1495112202596065286,2022-02-19 19:05:01+00:00,I would like the whole world to pray there is no war between Russia and Ukraine. These positive prayers can move mountains.. start! 🙏🏼🙏🏼🙏🏼,496,1030,10845,82
1496634774399721473,https://twitter.com/KatiePavlich/status/1496634774399721473,2022-02-23 23:55:11+00:00,"Joe Biden helped keep Ukraine out of NATO as Vice President, saying they needed to work on their corruption while his family indulged the corruption and got rich. Now Russia is at the door and will slaughter innocent Ukrainians. How shameful.",496,3126,10691,153
1499506552109158402,https://twitter.com/DmytroKuleba/status/1499506552109158402,2022-03-03 22:06:36+00:00,"When Russians can’t achieve real goals, they focus on fake TV coverage. Having seized a TV tower in Kherson, they plan a show: Russian troops provide humanitarian aid while fake ‘locals’ brought in from Crimea stage a fake ‘demo’ in favor of Kherson region ‘uniting’ with Crimea.",495,5620,17600,248
1500136766665338886,https://twitter.com/SenGaryPeters/status/1500136766665338886,2022-03-05 15:50:51+00:00,Honored to have met virtually with President Zelensky this morning. He’s a true inspiration leading his nation against illegal Russian aggression. The Senate must act swiftly to provide more aid to Ukraine &amp; the Ukrainian people. #StandWithUkraine https://t.co/82SGoFrNpd,495,84,702,21
1481297793650208772,https://twitter.com/disclosetv/status/1481297793650208772,2022-01-12 16:11:29+00:00,"JUST IN - Ukraine: Biden admin has sanctions ""ready to go"" in case Russian ""tanks cross the border."" (CNN)",490,415,2177,199
1499528183535882240,https://twitter.com/SecBlinken/status/1499528183535882240,2022-03-03 23:32:33+00:00,".@StateDept and @USTreasury have taken sweeping actions as part of our response, together with our allies and partners, to Putin's war on Ukraine. These actions make clear that there is nowhere to hide for individuals and entities that support Russia’s aggression.",488,588,2267,56
1495755876422111234,https://twitter.com/DmytroKuleba/status/1495755876422111234,2022-02-21 13:42:45+00:00,"No, Ukraine did NOT:

❌Attack Donetsk or Luhansk
❌Send saboteurs or APCs over the Russian border
❌Shell Russian territory
❌Shell Russian border crossing
❌Conduct acts of sabotage 

Ukraine also does NOT plan any such actions.

Russia, stop your fake-producing factory now.",487,5903,19046,380
1490194945902354435,https://twitter.com/BBCWorld/status/1490194945902354435,2022-02-06 05:25:36+00:00,Ukraine tensions: US sources say Russia 70% ready to invade Ukraine https://t.co/W9n1FBpjII,487,273,993,110
1500153084017877003,https://twitter.com/IAPonomarenko/status/1500153084017877003,2022-03-05 16:55:41+00:00,Russian troops leave Energodar,486,5349,39152,199
1499409303740035080,https://twitter.com/robbystarbuck/status/1499409303740035080,2022-03-03 15:40:10+00:00,Joe Biden is asking Congress to approve $10 BILLION in aid $ for Ukraine. Call me cold hearted but we don’t have $10B to give to other countries when our own country refuses to fund proper border security and proper care for veterans!,486,2394,9953,147
1499338157980098562,https://twitter.com/KyivIndependent/status/1499338157980098562,2022-03-03 10:57:27+00:00,"⚡️ Ukraine, Russia to hold new round of peace talks.

According to Vladimir Medinsky, assistant to Russian President Vladimir Putin, the second round of negotiations will take place on March 3 in Belarus, close to the Polish border.",485,2097,11956,166
1495113617993351171,https://twitter.com/olex_scherba/status/1495113617993351171,2022-02-19 19:10:39+00:00,"Anton Sydorov (34). Father of three girls. Killed by Putin’s shelling today.
#StandWithUkraine #BlockPutinWallets https://t.co/b63TrwRm4q",483,4791,13976,302
1490790301132333057,https://twitter.com/KatiePavlich/status/1490790301132333057,2022-02-07 20:51:19+00:00,"As the White House insists Russia could invade Ukraine at anytime, President Biden and the German Chancellor used their remarks at a joint press conference today to talk about...climate change.",483,1465,5725,94
1498002635881918468,https://twitter.com/polinaivanovva/status/1498002635881918468,2022-02-27 18:30:34+00:00,"Kyiv’s mayor says the city is now completely surrounded and all exits blocked by Russian troops. No way to evacuate civilians. 

Siege begins. https://t.co/eND142bcuR",481,4795,6786,885
1495891891795251209,https://twitter.com/cnnbrk/status/1495891891795251209,2022-02-21 22:43:13+00:00,Russian President Vladimir Putin orders Russian troops to enter two separatist-held regions in Ukraine https://t.co/vPWi5Kjqoo,480,868,1622,286
1499829210092912649,https://twitter.com/InnaSovsun/status/1499829210092912649,2022-03-04 19:28:43+00:00,"A #Ukrainian soldier rescued a baby. This child is lucky, it is alive. But other 28 children were killed by #Russian troops. https://t.co/cCBaTJ7cvi",479,5191,12027,420
1494770294271225861,https://twitter.com/RichardEngel/status/1494770294271225861,2022-02-18 20:26:24+00:00,"As far as fake operations go, this once seems pretty amateurish.  Why would Ukraine attack the separatists NOW, when the Russian military is on the border, weapons drawn?  It defies logic.",477,2531,16577,162
1496375521143312385,https://twitter.com/FoxNews/status/1496375521143312385,2022-02-23 06:45:00+00:00,"Obama's weak Russia policy emboldened Putin to invade Ukraine, and Biden's is emboldening Xi: MSNBC guest
https://t.co/hQjKuLowgU",477,242,1083,37
1490769998448578561,https://twitter.com/RepMattGaetz/status/1490769998448578561,2022-02-07 19:30:39+00:00,"While the Biden Admin, the media, and many in Congress beat the drums of war for Ukraine, there is a far more significant threat to our nation. 

China is a rising power. Russia is a declining power. Let us sharpen our focus so that we do not join them in that eventual fate. https://t.co/VUQwfUFCZ7",476,459,1823,70
1493544528304918531,https://twitter.com/trussliz/status/1493544528304918531,2022-02-15 11:15:38+00:00,"Russia could invade Ukraine at any moment and we urge the Kremlin to step back from the brink.

Any invasion would have severe consequences, including coordinated sanctions. 

But there is still time for diplomacy and for Russia to de-escalate. https://t.co/cmOvUR2fvl",475,120,492,67
1495455586158321666,https://twitter.com/Trish4DJT/status/1495455586158321666,2022-02-20 17:49:30+00:00,Is the Biden Administration promoting war with Ukraine to take America’s eyes off Biden’s failures &amp; tanking Poll Numbers?,472,760,2705,96
1498729319811612672,https://twitter.com/aravosis/status/1498729319811612672,2022-03-01 18:38:09+00:00,HOLEY COW! The Pentagon reports Russian troops in Ukraine are PUNCHING HOLES in their own gas tanks in order to get out of combat.,471,3370,17869,264
1498053050099019779,https://twitter.com/catturd2/status/1498053050099019779,2022-02-27 21:50:54+00:00,"The Biden regime and Democrats want 6 billion for Ukraine. 

That would’ve funded Trump’s entire southern border wall project. 

These people don’t give AF about you.",466,5008,17824,176
1498183686105227265,https://twitter.com/FoxNews/status/1498183686105227265,2022-02-28 06:30:00+00:00,"TIARA FOR ASSAULT RIFLE: Miss Ukraine takes on Russian forces, vows to kill anyone who crosses border. https://t.co/fYxPgIJt2J https://t.co/JhLvAxvFoc",465,536,4839,99
1494372937037664258,https://twitter.com/Breaking911/status/1494372937037664258,2022-02-17 18:07:26+00:00,"President Biden says there’s a “very high” probability that Russia will invade Ukraine. 

""They have not moved any of their troops out, they moved more troops in...we have reason to believe that they are engaged in a false flag operation."" https://t.co/uCZkRRG5rB",462,172,577,132
1498015729068691465,https://twitter.com/eucopresident/status/1498015729068691465,2022-02-27 19:22:36+00:00,"Address to the brave people of #Ukraine @ZelenskyyUa 

We are organising the emergency delivery of defensive military equipment.

Guns, ammunition, rockets, and fuel are on their way to your troops. 

Long live Europe!  Slava Ukraïni!

https://t.co/HmZXt2re93",461,686,2398,67
1496465641414483970,https://twitter.com/WalshFreedom/status/1496465641414483970,2022-02-23 12:43:06+00:00,"Trump never raised Russian bounties with Putin.
Trump ordered US troops out of Germany.

It’s as if Trump worked for Putin.

8/

https://t.co/T6Oom0540e",458,1928,7181,124
1494449458376949787,https://twitter.com/spectatorindex/status/1494449458376949787,2022-02-17 23:11:31+00:00,BREAKING: The Times reports the UK government believes Russia has decided to invade Ukraine,457,1785,6787,916
1500129084675960835,https://twitter.com/StateDept/status/1500129084675960835,2022-03-05 15:20:19+00:00,".@SecBlinken discusses the humanitarian crisis that Russia has sparked: As of today, 700,000 people have been forced to flee the violence perpetrated by Russia by crossing the border from Ukraine to Poland—with more coming every single day. https://t.co/sno11Pbf19",457,180,471,17
1496224958342926338,https://twitter.com/MuellerSheWrote/status/1496224958342926338,2022-02-22 20:46:43+00:00,"For those wondering why Putin didn’t invade Ukraine while Donald was in office; it’s because donald was destroying NATO for him and extorting Ukraine. Biden is tough on Putin, rebuilt NATO, and stands behind Ukraine. It’s obvious to anyone that’s not in a cult. #IStandWithUkraine",454,6682,26839,310
1499077601712869379,https://twitter.com/Charles_Lister/status/1499077601712869379,2022-03-02 17:42:06+00:00,"According to U.S. officials speaking today, ~100,000 #Russia troops inside #Ukraine (~70% of its entire deployed force) is running out, or has already run out of fuel &amp; food.",454,3400,16554,546
1494673679220883461,https://twitter.com/georgegalloway/status/1494673679220883461,2022-02-18 14:02:29+00:00,"100,000 #Ukraine army troops  including their fascist battalions appear to be about to #Invade the #Russian people of eastern #Ukraine. If they do it will mean all-out war which may well spread. The economic and energy costs will spiral throughout Europe immediately. Be warned.",453,510,1479,145
1491538297977516037,https://twitter.com/RepCawthorn/status/1491538297977516037,2022-02-09 22:23:36+00:00,"Today, I introduced legislation stating that if Biden sends any U.S. troops to the Russia/Ukraine border, he must also send the same number to the U.S./Mexico Border.

https://t.co/OdqOIHyTdc",452,92,441,51
1496299816317440001,https://twitter.com/TruthGundlach/status/1496299816317440001,2022-02-23 01:44:10+00:00,"Joe Biden needs, right now, to explain to American taxpayers what the definition of success is in any nvolvement in Ukraine. Before that Joe Biden needs to explain, convincingly, why American taxpayers should pay to defend the Ukraine border at all. Don’t hold your breath.",451,679,3980,81
1499528414520397826,https://twitter.com/FoxNews/status/1499528414520397826,2022-03-03 23:33:28+00:00,WATCH: Ukraine’s President Zelemskyy tells Fox News’ @TreyYingst it’s a ‘pity’ US support came AFTER the war began.  https://t.co/KwdG7iz5wd https://t.co/txAbaz6zUL,451,621,2805,113
1496252150837612550,https://twitter.com/pritipatel/status/1496252150837612550,2022-02-22 22:34:46+00:00,"Tonight I joined our trusted 5-Eyes partners who alongside 🇬🇧 represent a vital security alliance to help protect our homelands &amp; stand up to aggressors.

Our response to Russia's deeply concerning actions in Ukraine will be united &amp; robust.

🇬🇧🇺🇸🇨🇦🇦🇺🇳🇿
We all #StandWithUkraine🇺🇦 https://t.co/clZnu1QL8m",451,292,1129,53
1487156215750737927,https://twitter.com/nytimes/status/1487156215750737927,2022-01-28 20:10:46+00:00,"Breaking News: Russia has enough troops at Ukraine’s borders to invade the whole country, the Pentagon said. The U.S. is making plans to cut off Russian banks in the event of an invasion. https://t.co/fhUDNq95Bq",449,840,2321,190
1498064956255875073,https://twitter.com/rezarvhimi/status/1498064956255875073,2022-02-27 22:38:12+00:00,"Zelenskyy, a true leader, sitting down for a meal with his troops! #Zelensky #Ukraine https://t.co/w6LLqDDmnx",448,3835,31804,365
1488883785026482177,https://twitter.com/trussliz/status/1488883785026482177,2022-02-02 14:35:31+00:00,"Had to postpone my Ukraine visit this week but will be visiting as soon as possible.  

I spoke on the phone to @DmytroKuleba 🇺🇦 on 🇬🇧 support for Ukraine in the face of Russian aggression.

The UK and our allies stand with Ukraine. https://t.co/8Py53E17y6 https://t.co/O4pcyn6sjZ",448,166,754,30
1492406722392170497,https://twitter.com/olgatokariuk/status/1492406722392170497,2022-02-12 07:54:24+00:00,A calm morning in Kyiv. Fresh snow is falling. Thank you all for your concern and support #StandWithUkraine,447,2621,25595,155
1499099781695737859,https://twitter.com/Reuters/status/1499099781695737859,2022-03-02 19:10:14+00:00,"Over 7,000 Russian troops killed since start of invasion -Ukrainian official https://t.co/jCIzGO0Yzd https://t.co/SYexkoNdFy",447,630,2296,130
1496988842330673154,https://twitter.com/JuliaDavisNews/status/1496988842330673154,2022-02-24 23:22:07+00:00,"Trump is officially a part of the Kremlin's war propaganda, used to promote and legitimize Russia's invasion of Ukraine. https://t.co/wNZ8fHrTGg",444,2259,5242,241
1499823866893512708,https://twitter.com/andersostlund/status/1499823866893512708,2022-03-04 19:07:29+00:00,"Russian troops open fire against each other near Kyiv, 9 tanks and 4 armored personnel carriers were destroyed. https://t.co/TiqVuyXPLk",442,3557,15193,379
1494794277586677768,https://twitter.com/afneil/status/1494794277586677768,2022-02-18 22:01:42+00:00,"Russian propaganda now claiming Ukraine about to invade Donbas region. Obviously Ukraine waited til it was surrounded by 175,000 Russian troops before doing this. Beggars belief.",442,1595,11012,112
1499140793713541123,https://twitter.com/lesiavasylenko/status/1499140793713541123,2022-03-02 21:53:12+00:00,#Kharkiv will never forget #Ukraine will never forgive. The scale of destruction grows every day. The amount of reparations to be payed by #Russia - unimaginable #StandWithUkraine https://t.co/C48gSiUCD2,440,4986,18354,261
1487002499160719364,https://twitter.com/amnesty/status/1487002499160719364,2022-01-28 09:59:57+00:00,#Ukraine’s recent history is punctuated by conflicts involving Russian troops in Donbas &amp; illegal annexation of Crimea. These episodes have torn lives apart. Another escalation of conflict will have devastating consequences for human rights in the region. https://t.co/YeVv5yfBmt,440,71,113,4
1499453891146137628,https://twitter.com/VishnuNDTV/status/1499453891146137628,2022-03-03 18:37:20+00:00,"The journey into Ukraine, meant hopping onto a van belonging to a German NGO supplying aid, being stopped 6 times by Polish, Ukrainian border guards, being questioned twice about my intentions, crossing multiple blocks. But I'm in Lviv now. Will report responsibly. #Ukraine https://t.co/0uOThqQFNl",437,317,5391,62
1498380453551693828,https://twitter.com/guyverhofstadt/status/1498380453551693828,2022-02-28 19:31:53+00:00,"Ukrainian people ask for EU membership, they reject the tyranny &amp; violence of Putin's regime.

Tomorrow, the European Parliament will ask that #Ukraine is declared a candidate country. 🇺🇦🇪🇺 #StandWithUkraine https://t.co/SoTn29OWmd",436,3057,19426,221
1496633462513704964,https://twitter.com/Billbrowder/status/1496633462513704964,2022-02-23 23:49:58+00:00,"Having watched Putin bomb Russian apartment buildings to justify the Chechen war, murder Boris Nemtsov, poison Alexei Navalny, and now to invade Ukraine, it’s unbelievably offensive to see @TuckerCarlson trying to convince Americans that Putin’s a good guy https://t.co/thJjbGmwwb",435,2565,7248,167
1495463647275016197,https://twitter.com/PaulBegala/status/1495463647275016197,2022-02-20 18:21:32+00:00,“It’s been a class in Diplomacy 101.”  Former US Ambassador to NATO ⁦@IvoHDaalder⁩ on how the Biden-Harris Administration has handled Putin’s saber rattling in Ukraine.  https://t.co/HSLJCTtzBm,435,74,184,174
1489005969040359424,https://twitter.com/RonnyJacksonTX/status/1489005969040359424,2022-02-02 22:41:02+00:00,Biden is prepared to send thousands of troops to fight for Ukraine’s border but leaves our border TOTALLY OPEN! He serves the American people LAST!,434,1849,6312,105
1496590261333413902,https://twitter.com/ananavarro/status/1496590261333413902,2022-02-23 20:58:18+00:00,"“This is genius,” Trump said. ""Putin declares a big portion of the Ukraine — of Ukraine — Putin declares it as independent. Oh, that’s wonderful.""

""I said, 'How smart is that?' He's going to go in and be a peacekeeper…we could use that on our southern border.” https://t.co/lNfvYQnz29",431,1086,4683,96
1496920096647757824,https://twitter.com/richimedhurst/status/1496920096647757824,2022-02-24 18:48:57+00:00,"NATO said it won't be sending troops to Ukraine.

The West dangled NATO membership in front of Ukraine for years, just to throw it to the wolves when the Russian bear came?

The West uses you, then cuts you loose when you're no longer worth the cost.",429,4192,16299,302
1492753235186229248,https://twitter.com/cryptomanran/status/1492753235186229248,2022-02-13 06:51:19+00:00,What if Russia don’t invade Ukraine and Powell doesn’t make an emergency rate hike?,429,95,1865,9
1498360045419089920,https://twitter.com/chefjoseandres/status/1498360045419089920,2022-02-28 18:10:47+00:00,Reporting in from Hrebenne in Poland right on the border! This road goes to Lviv in Ukraine &amp; @WCKitchen has been serving meals to people waiting to cross from there…On this side volunteer firefighters are cooking for refugees. Amazing to see the support here! #ChefsForUkraine https://t.co/Aw01GS05dN,428,3868,28572,385
1495703230969483267,https://twitter.com/RT_com/status/1495703230969483267,2022-02-21 10:13:33+00:00,"❗️Projectile fired from #Ukraine destroys Russian border checkpoint in #Rostov region, FSB reports

Details: https://t.co/xoKk5yiYE2 https://t.co/RGiH1dByHa",424,88,153,149
1498059585801932804,https://twitter.com/TomJChicago/status/1498059585801932804,2022-02-27 22:16:52+00:00,Breaking- senator Tim Kaine on MSNBC just now says they are starting to see signs of Russian troops refusing to participate in the invasion and go over the border in to Ukraine.,423,5876,39534,269
1495133984988225537,https://twitter.com/MarshaBlackburn/status/1495133984988225537,2022-02-19 20:31:34+00:00,"Biden has failed to take action and sanction Russia. 

Putin sees now as his golden opportunity to invade Ukraine because he knows Biden is a weak leader. @JacquiHeinrich https://t.co/1PXwVU64nn",421,195,853,28
