id,url,date,content,replyCount,retweetCount,likeCount,quoteCount
1500029255685603329,https://twitter.com/AdityaRajKaul/status/1500029255685603329,2022-03-05 08:43:38+00:00,"Indian students stranded in Sumy, Ukraine in helpless desperation without food &amp; water are now heading towards the border which is 600kms away. This is scary and dangerous without guidance. I hope @opganga &amp; EAM @DrSJaishankar can immediately help them. Praying for their safety. https://t.co/TkKeaezRPv",231,911,3141,81
1494788414205579265,https://twitter.com/ragipsoylu/status/1494788414205579265,2022-02-18 21:38:24+00:00,"BREAKING — The Speaker of Russian Duma says Ukraine is provoking the start of a big war. 

Says, Russia doesn’t want war “but if there is a threat to the lives of citizens of the Russian Federation and compatriots living in the DPR and LPR, then Russia will stand up for them”",231,1259,3088,418
1495688173363552257,https://twitter.com/IAPonomarenko/status/1495688173363552257,2022-02-21 09:13:43+00:00,"So this is true. 
This is how Russia treats its conscripts deployed to the Ukrainian border. No food, no places to sleep, no money. At a train station 20 km away from Ukraine.
https://t.co/aVpdRhMMHO https://t.co/BF9QFGGnoZ",231,834,2486,136
1500245195295797251,https://twitter.com/MarketRebels/status/1500245195295797251,2022-03-05 23:01:42+00:00,"Russian Foreign Ministry is asking NATO to ""stop pumping weapons"" into Ukraine",231,80,763,45
1488882238855028738,https://twitter.com/cnnbrk/status/1488882238855028738,2022-02-02 14:29:22+00:00,"President Biden formally approves more US troops to Europe in show of support to NATO allies alarmed by Russia's moves near Ukraine, US officials say https://t.co/EPuGm6lqVA",231,161,643,67
1498953145640271872,https://twitter.com/nexta_tv/status/1498953145640271872,2022-03-02 09:27:33+00:00,"❗️Sources tell us about a planned provocation on the territory of #Belarus. 

The #Russian military is going to stage an attack on #Belarusian border guards dressed in #Ukrainian military uniforms. The main goal is to drag Belarus into a war against #Ukraine. https://t.co/CXRcBtkrbm",230,2651,7158,192
1495104324191588355,https://twitter.com/JDVance1/status/1495104324191588355,2022-02-19 18:33:43+00:00,What explains both the Russia hawkishness and the dereliction of duty at the border is this: elites don’t care if my neighbors die. Fentanyl coming across the border kills people I care about. Declaring the cartels a terrorist org would do more for them than a Ukraine war. https://t.co/KGMI4VVQPC,230,198,739,25
1485995617176461312,https://twitter.com/BBCNews/status/1485995617176461312,2022-01-25 15:18:58+00:00,"UK prepared to deploy soldiers to protect Nato allies should Russia invade Ukraine, PM Boris Johnson says https://t.co/CMRm9FNxud",230,203,703,83
1497324123206336513,https://twitter.com/TheNationNews/status/1497324123206336513,2022-02-25 21:34:24+00:00,"FG to Russia: Withdraw your troops from #Ukraine, stop aggression approach

Onyeama said that FG had stated that Nigeria does not condone the approach of aggression by Russia, calling on #Russia to pull back.

“Peace and diplomacy to be prioritised by both sides. https://t.co/B05z6wk3A0",230,120,633,49
1500139109490348041,https://twitter.com/SenDanSullivan/status/1500139109490348041,2022-03-05 16:00:09+00:00,"Just got off of a Zoom with Pres. @ZelenskyyUa of Ukraine—moral clarity, heroism, bravery on full display for this President and the courageous people he represents. #StandWithUkraine

A few critical points… 🧵 [1/7]",229,172,823,42
1499780403258871809,https://twitter.com/EU_Commission/status/1499780403258871809,2022-03-04 16:14:47+00:00,"We have suspended the cooperation with Russia and its ally Belarus in the European Neighbourhood Instrument cross-border cooperation programmes as well as in the Interreg Baltic Sea region programme.

The suspension has immediate effect.

#StandWithUkraine",229,227,667,13
1497673968320651264,https://twitter.com/spectatorindex/status/1497673968320651264,2022-02-26 20:44:34+00:00,"BREAKING: ABC News reports, citing a senior US official, that some Russian troops are 'disoriented' and have heard a soldier on radio say he doesn't know who to shoot.",228,1657,9035,264
1490793437540593667,https://twitter.com/cspan/status/1490793437540593667,2022-02-07 21:03:47+00:00,"President Biden: ""If Russia invades, that means tanks or troops crossing the border of Ukraine again, then there will be no longer a Nord Stream 2. We will bring an end to it."" 

@andrea_shalal: ""How will you do that exactly?""

Biden: ""I promise you, we will be able do that."" https://t.co/WZPA3GUMtt",228,129,355,165
1499420270108553222,https://twitter.com/SashaUstinovaUA/status/1499420270108553222,2022-03-03 16:23:44+00:00,"Ukrainian MPs signing national anthem of Ukraine 🇺🇦

Despite Russian bombs attacking Kyiv, they had a session in the parliament today to vote for the essential laws.

#StandWithUkraine https://t.co/xmS2isdQ2y",227,3759,15915,358
1493695840241737731,https://twitter.com/joncoopertweets/status/1493695840241737731,2022-02-15 21:16:54+00:00,Trump was such a pathetic LAPDOG of Putin — he would have allowed Russia to invade FLORIDA!,227,506,3194,32
1499876114902179842,https://twitter.com/WSJ/status/1499876114902179842,2022-03-04 22:35:06+00:00,"Vice President Kamala Harris will travel next week to Poland and Romania, NATO members that border Ukraine, her spokeswoman said Friday https://t.co/zbZFT40vS2",227,100,559,57
1497359328407289858,https://twitter.com/caitrionambalfe/status/1497359328407289858,2022-02-25 23:54:18+00:00,Praying for everyone in Ukraine tonight. This unprovoked war that Russia is waging is disgusting… I hope all Russians will not let Vladimir Putin continue this in their name. #IStandWithUkraine 🇺🇦,226,585,9806,21
1497353268686635012,https://twitter.com/olga_chyzh/status/1497353268686635012,2022-02-25 23:30:13+00:00,"To help, please call your Rep or MP to ask:
1. Cut Russia off from SWIFT
2. Provide air defense equipment to Ukraine
3. Send lethal weapons to Ukraine
4. Boycott Rus goods
5. Stop collaboration w/Russians who did not denounce the war
6. Use any influence you have to #StopPutin",225,2667,11289,133
1485018051951177734,https://twitter.com/nytimes/status/1485018051951177734,2022-01-22 22:34:28+00:00,"Breaking News: Britain said that Russia had begun developing plans to install a pro-Kremlin leader in Kyiv, as Russian troops threaten Ukraine’s borders. https://t.co/IcEsjUa1Xu",225,414,833,126
1498047559704715270,https://twitter.com/CheriDiNovo/status/1498047559704715270,2022-02-27 21:29:05+00:00,Excuse me. Weren't you the Trump supporter we all remember seeing wearing a MAGA hat? #PutinisFalling #StandwithUkraine https://t.co/7aW8hNxI8Z,224,315,1965,25
1492216082328924172,https://twitter.com/OgbeniDipo/status/1492216082328924172,2022-02-11 19:16:52+00:00,"Is Russia 🇷🇺 really going to invade Ukraine 🇺🇦 again? 

Will NATO get involved or they are just bluffing? 

Can Russia 🇷🇺 face 30 NATO countries? 

Will China 🇨🇳 get involved on the side of Russia 🇷🇺?",224,323,1414,62
1490409004136288260,https://twitter.com/BBCWorld/status/1490409004136288260,2022-02-06 19:36:11+00:00,Ukraine crisis: Macron says a deal to avoid war is within reach https://t.co/ABNFmedMFK,224,297,1191,76
1495424556814802945,https://twitter.com/FaceTheNation/status/1495424556814802945,2022-02-20 15:46:12+00:00,"NEWS: The U.S. has intelligence that Russian troops have received orders to proceed with an invasion of Ukraine. “The commanders on the ground are making specific plans for how they would maneuver in their sector of the battlefield,” CBS David Martin reports on @FacetheNation. https://t.co/uKsfdWRQjV",224,417,573,144
1487409627025264640,https://twitter.com/danhill2011/status/1487409627025264640,2022-01-29 12:57:44+00:00,"If Texas changed its name to ""Ukraine"" would Biden begin to care about our southern border?",223,919,3759,49
1492233901959524354,https://twitter.com/PARABOLIT/status/1492233901959524354,2022-02-11 20:27:41+00:00,"Ukraine doesn't want war 

Russia doesn't want war 

United States keeps pushing war",223,338,3506,33
1495141139564879879,https://twitter.com/StateDept/status/1495141139564879879,2022-02-19 21:00:00+00:00,".@POTUS: To the citizens of Russia: You are not our enemy.  And I do not believe you want a bloody, destructive war against Ukraine — a country and a people with whom you share such deep ties of family, history, and culture. https://t.co/K6usU8L4h1",223,492,1380,51
1496725521841164288,https://twitter.com/spectatorindex/status/1496725521841164288,2022-02-24 05:55:46+00:00,"WAR ON UKRAINE

- Air raid sirens in Kyiv and Lviv

- Blasts across several cities including Kyiv and Kharkiv

- Ukrainian military claims to have shot down Russian aircraft

- Troops and armored vehicles cross border, including from Belarus

- Bidens vows 'strong sanctions'",222,2760,8928,339
1496573430308786179,https://twitter.com/BenHopkinsAus/status/1496573430308786179,2022-02-23 19:51:25+00:00,"Russia is about to invade Ukraine, so @sunriseon7 calls in their penultimate expert in international relations, diplomacy and military tactics to provide their opinion. 

Jane Caro.

🤦‍♂️",222,83,983,24
1499777492894289935,https://twitter.com/JDVance1/status/1499777492894289935,2022-03-04 16:03:13+00:00,"The Dems &amp; RINOs ignore our own problems while potentially blundering us into another war that doesn't serve our national interest.

Instead of trying to trigger WW3 with a disastrous no fly zone in Ukraine, we should secure our own border to stop the fentanyl killing our kids. https://t.co/aZiWjE7qDi",222,224,694,13
1497280321947115528,https://twitter.com/Franklin_Graham/status/1497280321947115528,2022-02-25 18:40:21+00:00,"Our hearts break for the people of Ukraine in the midst of this crisis. @SamaritansPurse works with 3,000+ churches in Ukraine &amp; they need our prayers. We’ve deployed advance disaster response personnel to Poland &amp; Romania to assess ways to help those fleeing across the border.",221,452,3912,27
1498415475868512265,https://twitter.com/Lancegooden/status/1498415475868512265,2022-02-28 21:51:03+00:00,"Corrupt Russian oligarchs have enabled Putin's war.

That's why I have introduced legislation to allow U.S. citizens to SEIZE yachts and jets of sanctioned Russians.

We must use every tool at our disposal to stand up to Russia and stand with @Ukraine!

https://t.co/o6b61q4iHq",221,118,700,435
1493265060730392580,https://twitter.com/CNN/status/1493265060730392580,2022-02-14 16:45:08+00:00,"Oil prices have been climbing ever since the global economy started to recover from Covid-19. Now, as the United States warns that Russia could imminently invade Ukraine, they're pushing even higher.
https://t.co/LSG86C0nOZ",221,104,236,21
1493701354828746752,https://twitter.com/Breaking911/status/1493701354828746752,2022-02-15 21:38:49+00:00,"BIDEN: ""To the citizens of Russia: You are not our enemy, and I do not believe you want a bloody, destructive war against Ukraine.""

 https://t.co/64kutsvNDI",220,66,330,72
1499710859714744320,https://twitter.com/KyivIndependent/status/1499710859714744320,2022-03-04 11:38:26+00:00,"⚡️Panasonic suspends transactions with Russia.

The Japanese electronic conglomerate also decided to donate $173 million to the Polish Red Cross to help Ukrainian refugees at the border and to Peace Winds Japan, an NGO providing assistance to Ukraine.",219,6083,35828,269
1493296506492932104,https://twitter.com/RonnyJacksonTX/status/1493296506492932104,2022-02-14 18:50:05+00:00,"Biden’s complete incompetence will cause a war in Ukraine, and just like in Afghanistan, he’s doing NOTHING to evacuate trapped Americans. He doesn’t care if Americans are in harm’s way. Biden is totally USELESS!",219,736,2708,30
1497642414885855232,https://twitter.com/kaushikcbasu/status/1497642414885855232,2022-02-26 18:39:11+00:00,"Putin has little support within Russia, including from those close to him faking loyalty. So Biden should announce: if soldiers &amp; leaders refuse to take orders to invade &amp; the invasion stops he will give them amnesty. This could embolden them to do what most of them want to do.",219,152,861,108
1500251058081206272,https://twitter.com/FoxNews/status/1500251058081206272,2022-03-05 23:25:00+00:00,"Russia-Ukraine war: US must implement 'deterrent strategy' to push back against Putin, expert says
https://t.co/IomevHJPDs",219,73,264,11
1497349918226370561,https://twitter.com/espn/status/1497349918226370561,2022-02-25 23:16:54+00:00,"Washington Capitals star Alex Ovechkin issued an anti-war statement on Friday in his first comments following Russia's invasion of Ukraine.

""Please, no more war. It doesn't matter who is in the war ... we have to live in peace,"" he said. https://t.co/ubTGh8WdTE",218,742,5987,101
1494731858462093312,https://twitter.com/RepSwalwell/status/1494731858462093312,2022-02-18 17:53:40+00:00,"This guy is not going to let his country go down without a fight. Met with @Vitaliy_Klychko, mayor of #Kyiv, as Russia prepares to invade his country. He needs our help. A threat to a democracy anywhere is a threat to democracies everywhere. #MSC2022 https://t.co/jcenhvBJg0",218,754,4943,33
1494797904556572675,https://twitter.com/kgosztola/status/1494797904556572675,2022-02-18 22:16:07+00:00,"President Joe Biden says Russia President Putin is going to invade Ukraine. Reporter asks, ""What reason do you have to believe he's considering that option at all?"" Biden replies, ""We have significant intelligence capability."" Again, no evidence. Just trust us. https://t.co/C9wwFE8w4p",218,645,2176,142
1500141956667785218,https://twitter.com/SenatorHassan/status/1500141956667785218,2022-03-05 16:11:28+00:00,This morning a bipartisan group of my colleagues and I virtually met with President Zelensky. His courage and leadership have rallied the world. US and NATO must continue to provide support and aid to Ukraine. #StandWithUkraine https://t.co/o2BrBfEsNZ,218,67,408,36
1496966982436065287,https://twitter.com/haynesdeborah/status/1496966982436065287,2022-02-24 21:55:15+00:00,"NEW: Ukraine's Armed Forces believe more than 60 Russian battalion tactical groups – the equivalent of between 30,000 to 60,000 troops  - have been deployed on Ukrainian territory, according to an update on the invasion as of 8pm
It said the “enemy has an extremely low morale”",217,2544,11144,190
1500166486907932673,https://twitter.com/KyivIndependent/status/1500166486907932673,2022-03-05 17:48:56+00:00,"⚡️Russia announces resuming fighting in Mariupol and Volnovakha.

Earlier today temporary ceasefire was supposed to take place to create humanitarian corridors and allow civilians to leave Mariupol and Volnovakha, but Russian troops’ shelling halted the evacuation.",217,2085,7473,140
1493559549248380928,https://twitter.com/zerohedge/status/1493559549248380928,2022-02-15 12:15:20+00:00,Russia Withdraws Troops From Ukraine Border After Media Said Invasion Was Imminent https://t.co/voaOwlUlXx,217,461,2165,105
1493266340777533440,https://twitter.com/Reuters/status/1493266340777533440,2022-02-14 16:50:13+00:00,Russia could invade Ukraine at any moment - UK foreign minister Truss https://t.co/uwJgSMmB6v https://t.co/sMea6lO9SP,217,161,371,65
1498751565263519753,https://twitter.com/Tsihanouskaya/status/1498751565263519753,2022-03-01 20:06:33+00:00,"We #StandWithUkraine 

Belarusians resist the Russian invasion of 🇺🇦 Ukraine. They form military units &amp; fight alongside Ukrainians. In Belarus, they hack, disrupt the movement of 🇷🇺 troops, protest on the streets despite mass arrests. Diasporas join solidarity rallies worldwide. https://t.co/qufa9SUb4P",216,2677,10825,172
1495881319112392710,https://twitter.com/ReallyAmerican1/status/1495881319112392710,2022-02-21 22:01:13+00:00,The U.S. should sanction and financially cripple the Fascists in Russia if they decide to invade Ukraine. Who agrees? 🤚,216,813,4620,55
1491748800771330050,https://twitter.com/LadyRebecca_1/status/1491748800771330050,2022-02-10 12:20:04+00:00,"At the Nato press conference on the Ukraine crisis today Laura kuenssberg asked @BorisJohnson: ""if you were found to have broken the law would you resign""

I say that we must have the most pathetic media in the world 🌏

https://t.co/e56v4ZUOx3",216,535,2293,225
1492215362787676163,https://twitter.com/matthewjmartin_/status/1492215362787676163,2022-02-11 19:14:01+00:00,Not Putin threatening nuclear war with NATO over #Ukraine and y'all still wanna call the US and NATO the aggressors in this situation??#UkraineCrisis  https://t.co/VUc74cO0x0,216,473,1711,175
1498527217290203142,https://twitter.com/cnni/status/1498527217290203142,2022-03-01 05:15:04+00:00,"As the Russian invasion of Ukraine continues, foreign students attempting to leave the country say they are experiencing racist treatment by Ukrainian security forces and border officials. https://t.co/3KlBu2yr3k",216,360,821,47
1487374125727424520,https://twitter.com/GeorgePapa19/status/1487374125727424520,2022-01-29 10:36:40+00:00,Over one million illegals have crossed the border the past year. But Biden thinks sending troops to defend Eastern Europe and Ukraine is the priority.,215,1453,5791,64
1492966704145649675,https://twitter.com/CortesSteve/status/1492966704145649675,2022-02-13 20:59:34+00:00,".@MariaBartiromo smartly warns that the Washington War Machine could press for conflict in Ukraine as a giant ruse to distract from disastrous Biden failures at home, especially Inflation &amp; the new Durham bombshell news…

https://t.co/WfdvC0BTUD",215,940,2286,64
1485730377939386369,https://twitter.com/Reuters/status/1485730377939386369,2022-01-24 21:45:00+00:00,"Pentagon spokesperson John Kirby said that the U.S. has put about 8,500 troops on alert to be ready to deploy to Europe, potentially on very short notice, in the latest effort to reassure NATO allies in the face of a Russian military buildup near Ukraine https://t.co/6ZMY1Ixx8b https://t.co/xtCyQevsYD",215,468,888,328
1499526542925385748,https://twitter.com/SteveDaines/status/1499526542925385748,2022-03-03 23:26:02+00:00,Insane. Twitter continues to block the speech of Americans while allowing Putin and the Kremlin to spew out propaganda on their platform as Russia's war against a sovereign and independent Ukraine continues. https://t.co/AviVyp1tSb,215,25,70,12
1492102307131301888,https://twitter.com/palkisu/status/1492102307131301888,2022-02-11 11:44:46+00:00,"At the Ukraine-Russia border. Welcomed by the border force, adopted by a cat and almost run over by a truck 😅 https://t.co/4dY51AHCIL",214,428,9962,31
1498043209565433856,https://twitter.com/BaddCompani/status/1498043209565433856,2022-02-27 21:11:48+00:00,"Folks, President Biden has played this very well. He is letting the EU and NATO now take the lead so we don't send our own troops to Ukraine. We won't need to. 

Brilliant. 

He brought them together, said what he was hoping for, they listened and have all gotten on board.",214,1386,5881,62
1490018270740684808,https://twitter.com/ggreenwald/status/1490018270740684808,2022-02-05 17:43:33+00:00,"In the past year, Tucker Carlson: 1) repeatedly urged a pardon of Julian Assange, 2) condemned bipartisan scheme for the US to interfere in Cuba and is now 3) emphatically opposing US involvement in a war in Ukraine.

Call him whatever names you want. Nobody on NBC/CNN does that. https://t.co/7ZkgI3rBot",214,881,5123,38
1491779880547201025,https://twitter.com/SecBlinken/status/1491779880547201025,2022-02-10 14:23:34+00:00,I spoke with Secretary General @JensStoltenberg today about our work to promote Transatlantic security.  We stand united in our calls on Russia to de-escalate and engage in diplomacy with @NATO and Ukraine.,214,265,1093,19
1492792640252821509,https://twitter.com/BBCPolitics/status/1492792640252821509,2022-02-13 09:27:54+00:00,"Will Russia invade Ukraine? The BBC's James Landale explains how we reached this point

#Raworth https://t.co/gwxn6JyRhu https://t.co/xLClzNcE4w",214,166,548,51
1497352425052717059,https://twitter.com/JuliaDavisNews/status/1497352425052717059,2022-02-25 23:26:52+00:00,"Great points you just made on @CNN, @AdamKinzinger: Ukrainians will never submit to Putin. The fate of the West—not only Ukraine—is being decided tonight. We must do more to help. Declare a no-fly zone.
#StandWithUkraine",213,2385,11718,81
1496215623982096385,https://twitter.com/StevenBeschloss/status/1496215623982096385,2022-02-22 20:09:37+00:00,"As we watch the awful events unfold in Ukraine, remember that Donald Trump was bent on undermining NATO, serving the interests of Vladimir Putin.",213,2647,10546,104
1492234538176630786,https://twitter.com/Matt_VanDyke/status/1492234538176630786,2022-02-11 20:30:12+00:00,"World War 3, World War III, and WWIII trending thanks to #Russia bots &amp; propaganda accounts to scare people about #Ukraine. Fools play right into it, jumping on bandwagon, attacking #Biden to politicize &amp; divide Americans.

You’re #Putin’s useful idiots and don’t even realize it.",213,661,2132,65
1499166341567287303,https://twitter.com/SenDuckworth/status/1499166341567287303,2022-03-02 23:34:43+00:00,"Ukrainians who were here in the U.S. before Russia’s unprovoked invasion should not be forced to return to Ukraine in the middle of Putin’s war of choice.

@SenateDems and I are calling on @POTUS to grant these individuals Temporary Protected Status.",213,322,1837,5
1497721964655525890,https://twitter.com/visegrad24/status/1497721964655525890,2022-02-26 23:55:17+00:00,"Africans trying to escape from Ukraine are complaining of difficulty and discrimination at land borders into EU. 

BBC reports that at the Polish border Africans were selected from large queues and made to wait while “white” refugees were let in first.",213,218,929,92
1500140604076011526,https://twitter.com/SenDanSullivan/status/1500140604076011526,2022-03-05 16:06:05+00:00,"@ZelenskyyUa @POTUS @SecDef @SecBlinken God bless this courageous leader and the Ukrainian people who continue to fight for their liberty and survival.

#StandWithUkraine [7/7]",213,69,488,10
1498073451453689858,https://twitter.com/mooreholmes24/status/1498073451453689858,2022-02-27 23:11:58+00:00,"I suspect the Russia-Ukraine war will finally push RoI to abandon their immoral policy of neutrality. If not, it not only undermines their EU membership, but they will yet again, as in WW2, be found wanting in the fight against tyranny. Does neutrality represent Irish people?",213,25,209,9
1495889146153512966,https://twitter.com/FoxNews/status/1495889146153512966,2022-02-21 22:32:19+00:00,INCURSION TO BEGIN: Putin sending Russian ‘peacekeepers’ into parts of Ukraine as fears of a full-blown war mount https://t.co/Peaj2KLvoG,213,80,182,13
1495868891893010433,https://twitter.com/UkrEmbLondon/status/1495868891893010433,2022-02-21 21:11:50+00:00,"Ukraine needs international support!
We cry for the world to #StandWithUkraine",212,2385,7677,204
1498704839483834369,https://twitter.com/kajakallas/status/1498704839483834369,2022-03-01 17:00:52+00:00,Met with 🇬🇧 PM @BorisJohnson in Tapa 🇪🇪 where British troops are with #eFP. Must increase @NATO's deterrence &amp; defence posture. Need to deliver all military and economic aid possible to #Ukraine now. Tap into more ways to cripple Putin’s war machine. Our duty: #StandWithUkraine. https://t.co/UflritpAW1,212,405,2729,36
1499401207302934531,https://twitter.com/MarshaBlackburn/status/1499401207302934531,2022-03-03 15:08:00+00:00,Communist China reportedly asked Russia to wait until after the Genocide Games to invade Ukraine.,212,479,2100,33
1498801478655520768,https://twitter.com/sumlenny/status/1498801478655520768,2022-03-01 23:24:53+00:00,"After Putin has launched his extermination war on Ukraine, Russians have provided him with +11 percentage point support. https://t.co/ijqsoZ1qJL",212,395,863,127
1491907549368619009,https://twitter.com/DCBMEP/status/1491907549368619009,2022-02-10 22:50:52+00:00,Terrible timing too from Major - when the Prime Minister is doing such important work with NATO over defence of Ukraine he is bleeting on about undermining UK’s reputation. A disgrace. https://t.co/Gxv5UCCRqS,212,125,773,7
1495560632225124355,https://twitter.com/CNN/status/1495560632225124355,2022-02-21 00:46:55+00:00,"New satellite imagery shows intensified activity among Russian units close to Ukraine's northeastern border, with units that were in garrisons appearing to take up field positions. https://t.co/MLr2GbCeLP",212,201,619,32
1500258595128160257,https://twitter.com/Fio_edwards/status/1500258595128160257,2022-03-05 23:54:57+00:00,"Ending NATO's eastward expansion is the key to ending the war in Ukraine and bringing an end to the suffering of the Ukrainian people.

The main obstacle to a peaceful settlement is US imperialism's insistence that Ukraine join NATO.

A neutral Ukraine will bring about peace.",211,222,717,69
1489298891904221184,https://twitter.com/FoxNews/status/1489298891904221184,2022-02-03 18:05:00+00:00,Sen. Marco Rubio: I’m not in favor of sending US troops to Europe amid Russian threat https://t.co/O1bYtWhrrq,211,65,408,15
1496168397293465601,https://twitter.com/DeptofDefense/status/1496168397293465601,2022-02-22 17:01:58+00:00,.@SecDef: There's no reason for Russia to again invade Ukraine. https://t.co/AIuhxkrrmE,210,390,1310,36
1494416119876177920,https://twitter.com/BBCWorld/status/1494416119876177920,2022-02-17 20:59:02+00:00,"Russia looking for excuse to invade Ukraine, US says

https://t.co/95lg63AYK9",210,128,488,31
